{
  "$schema": "http://json-schema.org/draft-07/schema#",
  "title": "post-tester plugin manifest (plugin.json)",
  "description": "Describes a post-tester plugin: what it is, what it provides and which permissions it needs. Check it with `pt plugin validate`.",
  "type": "object",
  "additionalProperties": false,
  "required": ["name", "description", "version", "engine", "main", "provides", "permissions"],
  "properties": {
    "$schema": {
      "type": "string",
      "description": "Path or URL of this schema, for editor completion and validation. Ignored by post-tester."
    },
    "name": {
      "type": "string",
      "pattern": "^[a-z0-9][a-z0-9-]*$",
      "description": "Unique plugin id: lowercase letters, numbers and `-`, not starting with `-`, e.g. \"totp-generator\". Used in `pt plugin approve <name>`, in plugin auth names (\"<name>/<method>\") and, with `-` replaced by `_`, in MCP tool names.",
      "examples": ["totp-generator"]
    },
    "displayName": {
      "type": "string",
      "description": "Human-friendly name shown in the app. Defaults to `name`.",
      "examples": ["TOTP Generator"]
    },
    "description": {
      "type": "string",
      "pattern": "\\S",
      "description": "What the plugin does, in one sentence. Shown to users and AI agents. Must not be empty."
    },
    "version": {
      "type": "string",
      "pattern": "^\\d+\\.\\d+\\.\\d+([-+].*)?$",
      "description": "The plugin's version as MAJOR.MINOR.PATCH (semantic versioning), optionally with a pre-release or build suffix, e.g. \"1.0.0\" or \"1.0.0-beta.1\".",
      "examples": ["1.0.0"]
    },
    "engine": {
      "type": "string",
      "pattern": "^[\\s0-9A-Za-z.*^~<>=|+-]*[0-9*xX][\\s0-9A-Za-z.*^~<>=|+-]*$",
      "description": "post-tester versions the plugin works with, as an npm-style range: \"^0.1.0\" (caret; for 0.x only the same minor version matches), \"~0.1.0\" (patch updates), \">=0.1.0\", \">=0.1.0 <1.0.0\" (all must match), \"^0.1.0 || ^1.0.0\" (either), an exact version \"0.1.0\", or \"*\". Must include the running post-tester version.",
      "examples": ["^0.1.0"]
    },
    "main": {
      "type": "string",
      "minLength": 1,
      "pattern": "^(?!/)(?![A-Za-z]:)(?!(.*[/\\\\])?\\.\\.([/\\\\]|$)).+$",
      "description": "Entry file, relative to the plugin folder, that does `export default definePlugin({ ... })`. TypeScript (.ts) and JavaScript (.js) are supported. Absolute paths and `..` are not allowed.",
      "examples": ["index.ts"]
    },
    "provides": {
      "type": "array",
      "minItems": 1,
      "uniqueItems": true,
      "description": "The plugin types this plugin implements. Each one must match a key passed to definePlugin, and every key must be listed here.",
      "items": {
        "type": "string",
        "enum": ["template-function", "auth", "hook", "importer", "exporter", "codegen", "viewer", "mcp-tool"],
        "description": "template-function → templateFunctions, auth → auth, hook → hooks, importer → importers, exporter → exporters, codegen → codegen, viewer → viewers, mcp-tool → mcpTools."
      }
    },
    "permissions": {
      "type": "array",
      "uniqueItems": true,
      "description": "What the plugin may do outside its sandbox. Declare only what it uses; use [] for none. Users approve each permission before it takes effect.",
      "items": {
        "type": "string",
        "pattern": "^(network:(\\*|(\\*\\.)?[A-Za-z0-9.-]+|\\[[0-9A-Fa-f:.]+\\])|secrets:read|fs:read|fs:write)$",
        "description": "network:<host> (one host name, without scheme, port or path, e.g. network:api.github.com), network:*.<domain> (every sub-domain, e.g. network:*.example.com; not example.com itself), network:* (any host; avoid), secrets:read (ctx.secrets), fs:read (ctx.fs.read), fs:write (ctx.fs.write).",
        "examples": ["network:api.github.com", "network:*.example.com", "secrets:read", "fs:read", "fs:write"]
      }
    }
  }
}
